<?xml version="1.0" standalone="no"?>
<!-- *created  "Wed Sep 21 16:03:47 2022" *by "Paul E. Black" -->
<!-- *modified "Tue Sep 27 16:49:04 2022" *by "Paul E. Black" -->
<!DOCTYPE input SYSTEM "../dtd/input.dtd">
<!-- "language" for example used in the manual -->
    <input>
        <sample>
            <path>
                <dir>args</dir>
            </path>
            <comment>Command line args</comment>
            <flaws>
                <flaw flaw_type="default" safe="0" unsafe="0"/>
            </flaws>
            <imports>
            </imports>
            <code>
                {{out_var_name}} = args[1];
            </code>
            <input_type>input : Command line args</input_type>
            <output_type>string</output_type>
        </sample>
    </input>
<!-- end of input.xml -->
    
