<?xml version="1.0" standalone="no"?>
<!DOCTYPE input SYSTEM "../dtd/input.dtd">
    <input>
        <sample>
            <path>
                <dir></dir>
            </path>
            <comment>Command line args</comment>
            <flaws>
                <flaw flaw_type="default" safe="0" unsafe="0"/>
            </flaws>
            <imports>
            </imports>
            <code>{{out_var_name}} = sys.argv[1]</code>
            <input_type>input : Command line args</input_type>
            <output_type>string</output_type>
        </sample>
    </input>
