<?xml version="1.0" standalone="no"?>
<!DOCTYPE input SYSTEM "../dtd/input.dtd">
    <input>
        <!--
        <sample>
            <path>
                <dir></dir>
            </path>
            <comment></comment>
            <flaws>
                <flaw flaw_type="" safe=""/>
            </flaws>
            <imports>
                <import></import>
            </imports>
            <code></code>
            <input_type></input_type>
            <output_type></output_type>
        </sample>
        -->
<!--
        <sample>
            <path>
                <dir>shell_commands</dir>
            </path>
            <comment>input : shell commands</comment>
            <flaws>
                <flaw flaw_type="default" safe="0" unsafe="0"/>
            </flaws>
            <imports>
                <import>os</import>
            </imports>
            <code>os.system({{in_var_name}})</code>
            <input_type>string</input_type>
            <output_type></output_type>
        </sample>
-->
        <sample>
            <path>
                <dir>readline</dir>
            </path>
            <comment>input: direct user input in string</comment>
            <flaws>
                <flaw flaw_type="default" safe="0" unsafe="0"/>
            </flaws>
            <imports>
            </imports>
            <code>{{out_var_name}} = input()</code>
            <input_type>input : get user input in tainted</input_type>
            <output_type>string</output_type>
        </sample>

        <sample>
            <path>
                <dir>readline</dir>
            </path>
            <comment>input: integer from user input</comment>
            <flaws>
                <flaw flaw_type="default" safe="0" unsafe="0"/>
            </flaws>
            <imports>
            </imports>
            <code>
	    try:
	    INDENT
	        {{out_var_name}} = int(input())
	    DEDENT
	    except ValueError:
	    INDENT
	        {{out_var_name}} = 1776
	    DEDENT
	    </code>
            <input_type>input: get integer as tainted user input</input_type>
            <output_type>int</output_type>
        </sample>

        <sample>
            <path>
                <dir>none</dir>
            </path>
            <comment>No Input</comment>
            <flaws>
                <flaw flaw_type="default" safe="1" unsafe="0"/>
            </flaws>
            <imports>
            </imports>
            <code># no input</code>
            <input_type>input : no input</input_type>
            <output_type>none</output_type>
        </sample>

        <sample>
            <path>
                <dir>hardcoded_string</dir>
            </path>
            <comment>Hardcoded string as input</comment>
            <flaws>
                <flaw flaw_type="default" safe="1" unsafe="0"/>
            </flaws>
            <imports>
            </imports>
            <code>{{out_var_name}} = "-d /;echo Vulnerable: user command run"</code>
            <input_type>input : no input</input_type>
            <output_type>string</output_type>
        </sample>

        <sample>
            <path>
                <dir>hardcoded_integer</dir>
            </path>
            <comment>Hardcoded integer as input</comment>
            <flaws>
                <flaw flaw_type="CWE_369" safe="0" unsafe="0"/>
                <flaw flaw_type="default" safe="1" unsafe="0"/>
            </flaws>
            <imports>
            </imports>
            <code>{{out_var_name}} = 0</code>
            <input_type>input : no input</input_type>
            <output_type>int</output_type>
        </sample>

        <sample>
            <path>
                <dir>args</dir>
            </path>
            <comment>Command line args</comment>
            <flaws>
                <flaw flaw_type="default" safe="0" unsafe="0"/>
            </flaws>
            <imports>
            </imports>
            <code>{{out_var_name}} = sys.argv[1]</code>
            <input_type>input : Command line args</input_type>
            <output_type>string</output_type>
        </sample>

        <sample>
            <path>
                <dir>arg</dir>
            </path>
            <comment>input: integer from command line arg</comment>
            <flaws>
                <flaw flaw_type="default" safe="0" unsafe="0"/>
            </flaws>
            <imports>
            </imports>
            <code>
	    try:
	    INDENT
	        {{out_var_name}} = int(sys.argv[1])
	    DEDENT
	    except ValueError:
	    INDENT
	        {{out_var_name}} = 1776
	    DEDENT
	    </code>
            <input_type>input: integer from command line arg</input_type>
            <output_type>int</output_type>
        </sample>

        <sample>
            <path>
                <dir>env</dir>
            </path>
            <comment>input: environment variable</comment>
            <flaws>
                <flaw flaw_type="default" safe="0" unsafe="0"/>
            </flaws>
            <imports>
                <import>os</import>
            </imports>
            <code>{{out_var_name}} = os.environ['ADD']</code>
            <input_type>input: environment variable</input_type>
            <output_type>string</output_type>
        </sample>

        <sample>
            <path>
                <dir>env</dir>
            </path>
            <comment>input: integer from environment variable</comment>
            <flaws>
                <flaw flaw_type="default" safe="0" unsafe="0"/>
            </flaws>
            <imports>
                <import>os</import>
            </imports>
            <code>
	    try:
	    INDENT
	        {{out_var_name}} = int(os.environ['ADD'])
	    DEDENT
	    except ValueError:
	    INDENT
	        {{out_var_name}} = 1776
	    DEDENT
	    </code>
            <input_type>input: integer from environment variable</input_type>
            <output_type>int</output_type>
        </sample>

    <!-- Juliet has input from
	    File
	    PropertiesFile
	    Property
	    URLConnection
	    connect_tcp
	    listen_tcp
	    database
	    getCookies_Servlet
	    getParameter_Servlet
	    getQueryString_Servlet
    -->

    </input>
