<?xml version="1.0" standalone="no"?>
<!DOCTYPE input SYSTEM "../dtd/input.dtd">
    <input>
        <sample>
            <path>
                <dir>hardcoded</dir>
            </path>
            <comment>input is hardcoded string</comment>
            <flaws>
                <flaw flaw_type="OWASP_A01" safe="1" unsafe="0"/>
            </flaws>
            <imports>
            </imports>
            <code>{{out_var_name}} = 'hardcoded string'</code>
            <input_type>input : Command line args</input_type>
            <output_type>string</output_type>
        </sample>
    </input>
